{
  "id": "grok",
  "displayName": "Grok",
  "fidelity": "official",
  "headline": "credits",
  "credential": {
    "macos": {
      "kind": "file",
      "path": "~/.grok/auth.json",
      "fields": { "key": "$[entry].key", "email": "$[entry].email" },
      "expiry": "$[entry].expires_at as iso8601; absent counts as 30 days from now",
      "notes": "An object keyed '{issuer}::{client_id}', one entry per signed-in CLI. Trust only entries whose key starts with https://auth.x.ai or whose oidc_issuer is https://auth.x.ai; any other issuer is a customer IdP whose token is meant for a private proxy and must never reach the public endpoint. Prefer an unexpired trusted entry. A file that is there but empty or not yet whole JSON is the CLI mid-rewrite: credentialExpired, not needsAuth."
    },
    "windows": {
      "kind": "file",
      "path": "~/.grok/auth.json",
      "fields": { "key": "$[entry].key", "email": "$[entry].email" },
      "expiry": "$[entry].expires_at as iso8601"
    },
    "linux": {
      "kind": "file",
      "path": "~/.grok/auth.json",
      "fields": {
        "accessToken": "$.access_token"
      },
      "notes": "Home-relative on every platform, so the macOS block applies unchanged."
    }
  },
  "endpoints": [
    {
      "name": "billing",
      "method": "GET",
      "url": "https://cli-chat-proxy.grok.com/v1/billing?format=credits",
      "headers": { "Authorization": "Bearer {key}", "X-XAI-Token-Auth": "xai-grok-cli", "Accept": "application/json" },
      "timeoutSeconds": 15,
      "notes": "An expired credential throws before any request. 429 → flat 60 s, not persisted."
    }
  ],
  "response": {
    "windows": [
      { "id": "credits", "label": "{humanize(productUsage[0].product)} e.g. Grok Build", "usedPath": "$.config.creditUsagePercent", "unit": "percent", "resetAtPath": "$.config.currentPeriod.end ?? $.config.billingPeriodEnd", "resetUnit": "iso8601", "notes": "$.config must be an object or the response is bad. Fallback when creditUsagePercent is absent: one window per $.config.productUsage[*].usagePercent, the first forced to id 'credits' so the dial has its declared headline. No windows → nothingMetered." }
    ]
  },
  "errors": { "401": "needsAuth", "403": "needsAuth", "429": "rateLimited" },
  "polling": { "activeSeconds": 60, "idleSeconds": 300, "staleSeconds": 900, "backoff": "flat60" },
  "sessions": {
    "kind": "mtime",
    "macos": "~/.grok/active_sessions.json (array of {session_id, pid, opened_at, cwd}) and ~/.grok/sessions/<percent-encoded cwd>/<session_id>/updates.jsonl",
    "windows": "same under the user profile",
    "staleSeconds": 45,
    "notes": "A row is live when its pid is alive (start time within 5 minutes of opened_at), its session directory is found (encoded cwd first, then a scan for the id), and updates.jsonl was written within 45 s. Many sessions allowed; never waiting.",
    "linux": "~/.grok/active_sessions.json (array of {session_id, pid, opened_at, cwd}) and ~/.grok/sessions/<percent-encoded cwd>/<session_id>/updates.jsonl"
  },
  "status": { "enabled": true, "termsRisk": "medium" },
  "install": {
    "vendor": "xAI",
    "docsUrl": "https://docs.x.ai/build/cli/reference",
    "windows": {
      "kind": "cli",
      "detect": {"commands": ["grok.exe", "grok.cmd"], "paths": ["~/.grok/bin/grok.exe", "%LOCALAPPDATA%/Microsoft/WinGet/Packages/xAI.GrokBuild_*/grok.exe"]},
      "requires": [],
      "install": "irm https://x.ai/cli/install.ps1 | iex",
      "signIn": {"command": "grok login", "hint": "install.hint.grok"}
    },
    "macos": {
      "kind": "cli",
      "detect": {"commands": ["grok"], "paths": ["~/.grok/bin/grok", "~/.local/bin/grok", "/opt/homebrew/bin/grok", "/usr/local/bin/grok"]},
      "requires": [],
      "install": "curl -fsSL https://x.ai/cli/install.sh | bash",
      "signIn": {"command": "grok login", "hint": "install.hint.grok"}
    },
    "linux": {
      "kind": "cli",
      "detect": {
        "commands": [
          "grok"
        ],
        "paths": [
          "~/.local/bin/grok",
          "/usr/local/bin/grok"
        ]
      },
      "requires": [],
      "install": "curl -fsSL https://x.ai/cli/install.sh | bash",
      "signIn": {
        "command": "grok login",
        "hint": "install.hint.grok"
      }
    }
  }
}
