{
  "id": "copilot",
  "displayName": "GitHub Copilot",
  "fidelity": "official",
  "headline": "premium",
  "credential": {
    "macos": {
      "kind": "file",
      "path": "~/.config/github-copilot/apps.json",
      "fields": { "token": "$['github.com:*'].oauth_token", "user": "$['github.com:*'].user" },
      "notes": "One entry per OAuth app that signed in, keyed 'github.com:<client id>'. The older hosts.json keys entries by host only. Only the key github.com or github.com:<client id> is read: a bare prefix would also match an Enterprise host such as github.company.com. $XDG_CONFIG_HOME moves the directory. As a last resort the GitHub CLI token in ~/.config/gh/hosts.yml is tried; it may lack Copilot scope. $GH_CONFIG_DIR, then $XDG_CONFIG_HOME/gh, moves that file, in the order gh documents. Only the top-level github.com block's own oauth_token is read, which is the active account's: an Enterprise host's token, or another account's under users:, never reaches api.github.com. A file that is there but cannot be read is credentialExpired, not needsAuth."
    },
    "windows": {
      "kind": "file",
      "path": "%LOCALAPPDATA%/github-copilot/apps.json",
      "fields": { "token": "$['github.com:*'].oauth_token", "user": "$['github.com:*'].user" },
      "notes": "Same shape and rules; hosts.json alongside; the GitHub CLI token lives in %APPDATA%/GitHub CLI/hosts.yml. $XDG_CONFIG_HOME, when set, comes first for both: $XDG_CONFIG_HOME/github-copilot and $XDG_CONFIG_HOME/gh, with $GH_CONFIG_DIR ahead of it for gh."
    },
    "linux": {
      "kind": "file",
      "path": "~/.config/github-copilot/apps.json",
      "fields": {
        "token": "$['github.com:*'].oauth_token",
        "user": "$['github.com:*'].user"
      },
      "notes": "The C# was Windows-only from birth and produced ~/.local/share/github-copilot/apps.json and '~/.config/GitHub CLI/hosts.yml' on Linux, both wrong. Copilot CLI follows the XDG base directory specification here: $XDG_CONFIG_HOME/github-copilot/apps.json, ~/.config when that is unset, with the gh CLI's own token in $GH_CONFIG_DIR, then $XDG_CONFIG_HOME/gh, then ~/.config/gh. Otherwise the macOS block applies unchanged."
    }
  },
  "endpoints": [
    {
      "name": "usage",
      "method": "GET",
      "url": "https://api.github.com/copilot_internal/user",
      "headers": { "Authorization": "token {token}", "Accept": "application/json", "Editor-Version": "vscode/1.104.0", "Editor-Plugin-Version": "copilot-chat/0.30.0", "User-Agent": "GitHubCopilotChat/0.30.0" },
      "timeoutSeconds": 15,
      "notes": "GitHub answers an exhausted rate limit with 403 as often as with 429. A 403 carrying x-ratelimit-remaining: 0 or Retry-After is rateLimited, backing off exponentially like a 429; any other 403 means the account has no Copilot seat."
    }
  ],
  "response": {
    "windows": [
      { "id": "premium", "label": "Premium requests", "usedPath": "$.quota_snapshots.premium_interactions.percent_remaining", "unit": "percentRemaining", "resetAtPath": "$.quota_reset_date", "resetUnit": "dateUtc", "notes": "usedFraction = 1 - percent_remaining / 100, clamped to [0, 1]. A snapshot with unlimited=true is not a window. remaining=0 with overage_permitted=false is a hard limit." },
      { "id": "chat", "label": "Chat", "usedPath": "$.quota_snapshots.chat.percent_remaining", "unit": "percentRemaining", "resetAtPath": "$.quota_reset_date", "resetUnit": "dateUtc", "notes": "Only metered on the Free plan." },
      { "id": "completions", "label": "Completions", "usedPath": "$.quota_snapshots.completions.percent_remaining", "unit": "percentRemaining", "resetAtPath": "$.quota_reset_date", "resetUnit": "dateUtc", "notes": "Only metered on the Free plan." }
    ]
  },
  "errors": { "401": "needsAuth", "403": "nothingMetered", "403 with x-ratelimit-remaining: 0 or Retry-After": "rateLimited", "404": "badResponse", "429": "rateLimited" },
  "polling": { "activeSeconds": 60, "idleSeconds": 300, "staleSeconds": 900, "backoff": "exponential" },
  "sessions": { "kind": "none", "notes": "Copilot's agents leave no readable trace on disk; usage only." },
  "status": { "enabled": true, "termsRisk": "medium", "notice": "Uses the GitHub OAuth token the Copilot plugin stores; the endpoint is the one the editor status bar reads. A 403 means the account has no Copilot seat, unless it carries GitHub's rate-limit headers." },
  "install": {
    "vendor": "GitHub",
    "docsUrl": "https://docs.github.com/en/copilot/how-tos/set-up/install-copilot-cli",
    "windows": {
      "kind": "cli",
      "detect": {"commands": ["copilot.exe", "copilot.cmd"], "paths": ["%LOCALAPPDATA%/Microsoft/WinGet/Packages/GitHub.Copilot_*/copilot.exe"]},
      "requires": ["winget"],
      "install": "winget install GitHub.Copilot --accept-source-agreements --accept-package-agreements",
      "signIn": {"command": "copilot", "hint": "install.hint.copilot"}
    },
    "macos": {
      "kind": "cli",
      "detect": {"commands": ["copilot"], "paths": ["~/.local/bin/copilot", "/opt/homebrew/bin/copilot", "/usr/local/bin/copilot"]},
      "requires": ["brew"],
      "install": "brew install --cask copilot-cli",
      "signIn": {"command": "copilot", "hint": "install.hint.copilot"}
    },
    "linux": {
      "kind": "cli",
      "detect": {
        "commands": [
          "copilot"
        ],
        "paths": [
          "~/.local/bin/copilot",
          "/usr/local/bin/copilot"
        ]
      },
      "requires": [
        "npm"
      ],
      "install": "npm install -g @github/copilot",
      "signIn": {
        "command": "copilot",
        "hint": "install.hint.copilot"
      }
    }
  }
}
