{
  "id": "cursor",
  "displayName": "Cursor",
  "fidelity": "official",
  "headline": "included",
  "credential": {
    "macos": {
      "kind": "sqlite",
      "path": "~/Library/Application Support/Cursor/User/globalStorage/state.vscdb",
      "query": "SELECT value FROM ItemTable WHERE key = ?",
      "fields": { "accessToken": "cursorAuth/accessToken", "accountId": "cursorAuth/stripeMembershipAuthId", "email": "cursorAuth/cachedEmail", "plan": "cursorAuth/stripeMembershipType" },
      "notes": "WAL mode. Open read-only but never immutable while the editor runs, or you read the state at the last checkpoint: an already-rotated token. Fall back to immutable=1 once the editor has quit, which shows as a failure to open; a read the editor holds busy (SQLITE_BUSY, SQLITE_LOCKED) never falls back and is credentialExpired, not needsAuth."
    },
    "windows": {
      "kind": "sqlite",
      "path": "%APPDATA%/Cursor/User/globalStorage/state.vscdb",
      "query": "SELECT value FROM ItemTable WHERE key = ?",
      "fields": { "accessToken": "cursorAuth/accessToken", "accountId": "cursorAuth/stripeMembershipAuthId", "email": "cursorAuth/cachedEmail", "plan": "cursorAuth/stripeMembershipType" }
    },
    "linux": {
      "kind": "sqlite",
      "path": "~/.config/Cursor/User/globalStorage/state.vscdb",
      "query": "SELECT value FROM ItemTable WHERE key = 'cursorAuth/accessToken'",
      "notes": "Electron keeps its user data under $XDG_CONFIG_HOME on Linux, so the directory is ~/.config/Cursor rather than the macOS Application Support path."
    }
  },
  "endpoints": [
    {
      "name": "usage",
      "method": "GET",
      "url": "https://cursor.com/api/usage-summary",
      "headers": { "Cookie": "WorkosCursorSessionToken={accountId}::{accessToken}", "Accept": "application/json" },
      "timeoutSeconds": 15,
      "notes": "Bearer auth on the same token is rejected; the cookie pair is what works. Re-read the credential on every fetch."
    }
  ],
  "response": {
    "windows": [
      { "id": "included", "label": "Included usage", "usedPath": "$.individualUsage.plan.totalPercentUsed", "unit": "percent", "resetAtPath": "$.billingCycleEnd", "resetUnit": "iso8601", "notes": "Zero is a reading, not an absence." },
      { "id": "api", "label": "API usage", "usedPath": "$.individualUsage.plan.apiPercentUsed", "unit": "percent", "resetAtPath": "$.billingCycleEnd", "resetUnit": "iso8601", "notes": "Only when > 0." },
      { "id": "on_demand", "label": "On demand", "usedPath": "$.individualUsage.onDemand.used / $.individualUsage.onDemand.limit", "unit": "usedOverLimit", "resetAtPath": "$.billingCycleEnd", "resetUnit": "iso8601", "notes": "Only when enabled is true and limit > 0; dollar-denominated." }
    ]
  },
  "errors": { "401": "needsAuth", "403": "needsAuth" },
  "polling": { "activeSeconds": 60, "idleSeconds": 300, "staleSeconds": 900, "backoff": "none" },
  "sessions": {
    "kind": "sqlite",
    "macos": "state.vscdb: SELECT value FROM composerHeaders WHERE isArchived = 0 ORDER BY recency DESC LIMIT 40",
    "windows": "same",
    "staleSeconds": 900,
    "notes": "Polled every 2 s (the writes land in the WAL sidecar). Fields: composerId, hasBlockingPendingActions | hasPendingPlan → waiting; unfinishedRunAt (set while a run is in flight, but it is the composer's creation time) plus conversationCheckpointLastUpdatedAt | lastUpdatedAt within 15 minutes and not before the editor's own start time → busy; otherwise dropped. Timestamps in epoch millis. The editor start time is the oldest Cursor process.",
    "linux": "~/.config/Cursor/User/globalStorage/state.vscdb: SELECT value FROM composerHeaders WHERE isArchived = 0 ORDER BY recency DESC LIMIT 40"
  },
  "status": { "enabled": true, "termsRisk": "high", "notice": "Reuses the editor's browser session cookie against cursor.com." },
  "install": {
    "vendor": "Cursor",
    "docsUrl": "https://cursor.com/docs/get-started/installation",
    "windows": {
      "kind": "app",
      "detect": {"commands": ["Cursor.exe"], "paths": ["%LOCALAPPDATA%/Programs/cursor/Cursor.exe"]},
      "requires": ["winget"],
      "install": "winget install Anysphere.Cursor --accept-source-agreements --accept-package-agreements",
      "downloadUrl": "https://cursor.com/downloads"
    },
    "macos": {
      "kind": "app",
      "detect": {"commands": [], "paths": ["/Applications/Cursor.app", "~/Applications/Cursor.app"]},
      "requires": ["brew"],
      "install": "brew install --cask cursor",
      "downloadUrl": "https://cursor.com/downloads"
    },
    "linux": {
      "kind": "app",
      "detect": {
        "commands": [
          "cursor"
        ],
        "paths": [
          "~/.local/bin/cursor",
          "/usr/bin/cursor",
          "/opt/Cursor/cursor",
          "~/Applications/Cursor.AppImage"
        ]
      },
      "requires": [],
      "install": "",
      "downloadUrl": "https://cursor.com/downloads"
    }
  }
}
