{
  "id": "opencode",
  "displayName": "OpenCode",
  "fidelity": "official",
  "headline": "rolling",
  "credential": {
    "macos": {
      "kind": "sqlite",
      "path": "~/.local/share/opencode/opencode.db",
      "query": "SELECT value FROM credential WHERE integration_id = $id AND active = 1 ORDER BY time_created DESC, time_updated DESC LIMIT 1, run for $id = 'opencode' (OpenCode Console) first and 'opencode-go' second; the first key found wins",
      "fields": { "token": "value is {\"type\":\"key\",\"key\":\"<key>\"}: its key | apiKey | api_key | token | accessToken" },
      "fallback": { "kind": "file", "path": "~/.local/share/opencode/auth.json", "fields": { "token": "$['opencode-go'] as string, or its key | apiKey | api_key | token | accessToken" } },
      "notes": "opencode v2 writes logins to its SQLite store and no longer to auth.json. Replacing a key adds a row with active = 1 and sets the old row to active = 0, so the newest active row wins. auth.json (opencode v1) is read only when the database is missing or holds no active opencode-go row; a v1 file left behind holds whatever key was current when v2 took over. A store opencode holds busy is transient (credentialExpired), never a fallback to auth.json. The Console key comes first because the usage endpoint accepts it and refuses Go keys that opencode still runs on (seen 2026-10-18: both Go keys, legacy and new, answered api_key_expired while opencode worked; the Console key answered 200). Only opencode and opencode-go: every other integration (openai, google…) is that vendor's key and is never claimed. OpenCode keeps its data in the XDG data directory on every platform, so $XDG_DATA_HOME moves both files. Seen on opencode v2.0.32, Linux."
    },
    "windows": {
      "kind": "sqlite",
      "path": "~/.local/share/opencode/opencode.db",
      "fields": { "token": "same" },
      "fallback": { "kind": "file", "path": "~/.local/share/opencode/auth.json" },
      "notes": "Same as macOS. Unverified on Windows; OpenCode may also use %APPDATA%/opencode. $XDG_DATA_HOME moves it here too."
    },
    "linux": {
      "kind": "sqlite",
      "path": "~/.local/share/opencode/opencode.db",
      "fallback": { "kind": "file", "path": "~/.local/share/opencode/auth.json" },
      "notes": "Already the XDG data directory on every platform, so this is the macOS block unchanged. Confirmed on the maintainer's machine, opencode v2.0.32. $XDG_DATA_HOME moves it."
    }
  },
  "endpoints": [
    {
      "name": "usage",
      "method": "GET",
      "url": "https://opencode.ai/zen/go/v1/usage",
      "headers": { "Authorization": "Bearer {token}", "Accept": "application/json" },
      "timeoutSeconds": 15,
      "notes": "401 with error.code = api_key_expired → rejected. The body says the key expired, but the endpoint sends it for Go keys opencode itself runs on without trouble, so it is not evidence about the key: it means usage wants the OpenCode Console key. The card never says the key expired; it says to connect OpenCode Console with opencode auth login, and drops the last reading. Any other 401 → needsAuth (a missing Go plan and a bad key look the same upstream, body {\"type\":\"error\",\"error\":{\"type\":\"AuthError\",\"message\":\"Unauthorized\"}}). 403 → nothingMetered: a valid key without a Go subscription. Zen pay-as-you-go credit has no API at all."
    }
  ],
  "response": {
    "windows": [
      { "id": "rolling", "label": "5h limit", "usedPath": "$.usage.rolling.percent", "unit": "percent", "resetAtPath": "$.usage.rolling.resetsAt", "resetUnit": "iso8601", "notes": "Fixed table driven by the client. A window without percent is dropped; no windows at all is a bad response, not zeros. Timestamps carry milliseconds." },
      { "id": "weekly", "label": "Weekly limit", "usedPath": "$.usage.weekly.percent", "unit": "percent", "resetAtPath": "$.usage.weekly.resetsAt", "resetUnit": "iso8601" },
      { "id": "monthly", "label": "Monthly limit", "usedPath": "$.usage.monthly.percent", "unit": "percent", "resetAtPath": "$.usage.monthly.resetsAt", "resetUnit": "iso8601" }
    ]
  },
  "errors": { "401": "needsAuth", "403": "nothingMetered", "429": "rateLimited" },
  "polling": { "activeSeconds": 60, "idleSeconds": 300, "staleSeconds": 900, "backoff": "exponential" },
  "sessions": { "kind": "none" },
  "status": { "enabled": true, "termsRisk": "low", "notice": "Plan is always 'Go'." },
  "install": {
    "vendor": "OpenCode",
    "docsUrl": "https://opencode.ai/docs/",
    "windows": {
      "kind": "cli",
      "detect": {"commands": ["opencode.exe", "opencode.cmd"], "paths": ["%LOCALAPPDATA%/Microsoft/WinGet/Packages/SST.opencode_*/opencode.exe", "~/.opencode/bin/opencode.exe"]},
      "requires": ["winget"],
      "install": "winget install SST.opencode --accept-source-agreements --accept-package-agreements",
      "signIn": {"command": "opencode auth login", "hint": "install.hint.opencode"}
    },
    "macos": {
      "kind": "cli",
      "detect": {"commands": ["opencode"], "paths": ["~/.opencode/bin/opencode", "~/.local/bin/opencode", "/opt/homebrew/bin/opencode", "/usr/local/bin/opencode"]},
      "requires": ["brew"],
      "install": "brew install opencode",
      "signIn": {"command": "opencode auth login", "hint": "install.hint.opencode"}
    },
    "linux": {
      "kind": "cli",
      "detect": {
        "commands": [
          "opencode"
        ],
        "paths": [
          "~/.opencode/bin/opencode",
          "~/.local/bin/opencode",
          "/usr/local/bin/opencode"
        ]
      },
      "requires": [],
      "install": "curl -fsSL https://opencode.ai/install | bash",
      "signIn": {
        "command": "opencode auth login",
        "hint": "install.hint.opencode"
      }
    }
  }
}
